<?xml version="1.0"?>
<!DOCTYPE Report
[
<!ELEMENT Report (General ,(Doc|BPT)) >
<!ATTLIST Report ver CDATA #REQUIRED tmZone CDATA #REQUIRED>

<!ELEMENT General ( DocLocation ) >
<!ATTLIST General productName CDATA #REQUIRED productVer CDATA #REQUIRED os CDATA #REQUIRED host CDATA #REQUIRED qcserver CDATA #IMPLIED qcproject CDATA #IMPLIED SolManSolutionId CDATA #IMPLIED SolManProjectId CDATA #IMPLIED SolManTestPlanId CDATA #IMPLIED SolManTestPackageId CDATA #IMPLIED SolManUserInfoData CDATA #IMPLIED  >

<!ELEMENT BPT (DName,Res,DVer?,TSet?,TInst?,NodeArgs,AdditionalInfo*,Doc*) >
<!ATTLIST BPT rID ID #REQUIRED >

<!ELEMENT Doc (DName,ConfName?,Res,DVer?,TSet?,TInst?,RunType?,DT?,AdditionalInfo*,Step*,DIter*,Step*,Action*,Doc*,Summary?,TestMaintenanceSummary*,NodeArgs?) >
<!ATTLIST Doc rID ID #REQUIRED type (Test|BC|BPTWrapperTest|Flow|Group|Action) "Test" productName CDATA #REQUIRED BCIter CDATA #IMPLIED >

<!ELEMENT RunType ( #PCDATA )>
<!ATTLIST RunType fmStep (False|True) "False" batch (False|True) "False" upDesc (False|True) "False" upChk (False|True) "False" upAS (False|True) "False">

<!ELEMENT DName ( #PCDATA ) >

<!ELEMENT ConfName ( #PCDATA ) >

<!ELEMENT Res ( #PCDATA ) >

<!ELEMENT AdditionalInfo (AdditionalDataName,AdditionalDataValue ) >

<!ELEMENT AdditionalDataName ( #PCDATA ) >

<!ELEMENT AdditionalDataValue ( #PCDATA ) >

<!ELEMENT DVer ( #PCDATA ) >

<!ELEMENT TSet ( #PCDATA ) >

<!ELEMENT TInst ( #PCDATA ) >

<!ELEMENT DIter (Step*,Action+,Summary?,NodeArgs)>
<!ATTLIST DIter rID ID #REQUIRED iterID CDATA #REQUIRED>

<!ELEMENT DocLocation ( #PCDATA )>

<!ELEMENT Action (AName,AIter*,(Step|HtmlStep|Action)*, Summary,ActionMaintenanceSummary*, NodeArgs ) >
<!ATTLIST Action rID ID #REQUIRED>

<!ELEMENT AIter ((Step|HtmlStep|Action)*,DataMapping?, Summary?,NodeArgs) >
<!ATTLIST AIter rID ID #REQUIRED iterID CDATA #REQUIRED isCountable (False|True) "False" >

<!ELEMENT AName ( #PCDATA ) >

<!ELEMENT TestMaintenanceSummary (ActionMaintenanceSummary*) >
<!ATTLIST TestMaintenanceSummary ObjectsAdded CDATA #REQUIRED ObjectsUpdated CDATA #REQUIRED StepsUpdated CDATA #REQUIRED StepsComments CDATA #REQUIRED><!ELEMENT ActionMaintenanceSummary (ObjectChange* ) >
<!ATTLIST ActionMaintenanceSummary Action CDATA #REQUIRED Objects CDATA #REQUIRED Updated CDATA #REQUIRED LinesTotal CDATA #REQUIRED Added CDATA #REQUIRED LinesUpdated CDATA #REQUIRED>

<!ELEMENT ObjectChange  (Hierarchy, PropertyChangeList* ) >
<!ATTLIST ObjectChange Operation CDATA #IMPLIED OriginalRepository CDATA #IMPLIED>

<!ELEMENT PropertyChangeList (PropertyDef*) >

<!ELEMENT PropertyDef (OriginalValue, NewValue) >
<!ATTLIST PropertyDef PropName CDATA #REQUIRED OriginRegularExpression (True|False) "False" NewRegularExpression (True|False) "False" AddedProperty (True|False) "False" >

<!ELEMENT OriginalValue ( #PCDATA )>

<!ELEMENT NewValue ( #PCDATA )>

<!ELEMENT Hierarchy  (ObjectName, Hierarchy*) >
<!ATTLIST Hierarchy MicClass CDATA #REQUIRED>

<!ELEMENT ObjectName  ( #PCDATA ) >

<!ELEMENT Step (Obj,Details,Time,TimeTick* ,(Step|HtmlStep|Doc)*, DataMapping?, NodeArgs) >
<!ATTLIST Step rID ID #REQUIRED retval CDATA #IMPLIED>

<!ELEMENT HtmlStep (HTML,TimeTick*,(Step|HtmlStep|Doc)*,NodeArgs) >
<!ATTLIST HtmlStep rID ID #REQUIRED >

<!ELEMENT Obj ( #PCDATA ) >
<!ATTLIST Obj plainTxt (False|True) "True">

<!ELEMENT Details ( #PCDATA ) >
<!ATTLIST Details plainTxt (False|True) "True">

<!ELEMENT Time ( #PCDATA ) >

<!ELEMENT HTML ( #PCDATA ) >

<!ELEMENT Disp ( #PCDATA ) >

<!ELEMENT TimeTick ( #PCDATA ) >

<!ELEMENT DataMapping ( DataMappedItem* )>
<!ELEMENT DataMappedItem EMPTY >
<!ATTLIST DataMappedItem dsName CDATA #REQUIRED >
<!ATTLIST DataMappedItem rowId CDATA #REQUIRED >

<!ELEMENT NodeArgs (Disp,TopPane?,BtmPane?,ExtendedInfo? )>
<!ATTLIST NodeArgs eType CDATA #REQUIRED icon CDATA #REQUIRED nRep CDATA #REQUIRED UserNote CDATA #IMPLIED filter (False|True) "True">
<!ATTLIST NodeArgs status (Passed|Failed|Done|Warning|Information) "Done">
<!ATTLIST NodeArgs iconSel CDATA #IMPLIED nType CDATA #IMPLIED MovieMarker CDATA "">
<!ATTLIST NodeArgs Source CDATA #IMPLIED SourceLine CDATA #IMPLIED StepFlowItemKey CDATA #IMPLIED >

<!ELEMENT TopPane (Path)>

<!ELEMENT BtmPane ( (Path|WR)?,ASHilite?)>
<!ATTLIST BtmPane vType CDATA "HTML">

<!ELEMENT Path ( #PCDATA ) >

<!ELEMENT ASHilite ( #PCDATA ) >

<!ELEMENT WR ( #PCDATA ) >

<!ELEMENT ExtendedInfo ( StepData ) >

<!ATTLIST ExtendedInfo StepType CDATA #REQUIRED>
<!ELEMENT DT (NodeArgs) >
<!ATTLIST DT rID ID #REQUIRED>

<!ELEMENT Summary (Param*)>
<!ATTLIST Summary sTime CDATA #IMPLIED eTime CDATA #IMPLIED passed CDATA #IMPLIED failed CDATA #IMPLIED warnings CDATA #IMPLIED retval CDATA #IMPLIED stopped (False|True) "False" >

<!ELEMENT Param (ParamName,ParamVal)+ >
<!ATTLIST Param paramInOut (In|Out) "In">

<!ELEMENT ParamName ( #PCDATA ) >

<!ELEMENT ParamVal ( #PCDATA ) >

]
>
<Report ver="2.0" tmZone="India Standard Time">
<General productName="HPE Unified Functional Testing" productVer="14.03" os="" host="LAPTOP-JSM3LDOQ"><DocLocation><![CDATA[D:\DataDrivenFramework\Driver\Driver]]></DocLocation></General>
<Doc rID="T1"   productName= "HPE Unified Functional Testing"  >
<DName><![CDATA[Driver]]></DName>
<Res><![CDATA[Res43]]></Res>
<DT rID="T2">
<NodeArgs eType="Table" icon="2" nRep="4" filter="False" >
<Disp><![CDATA[Run-Time Data Table]]></Disp>
<BtmPane vType="Table" >
<Path><![CDATA[Default.xls]]></Path>
</BtmPane>
</NodeArgs>
</DT>
<Action rID="T3">
<AName><![CDATA[Action1]]></AName>
<Step rID="T4">
<Obj plainTxt="False" ><![CDATA[start]]></Obj>
<Details plainTxt="False" ><![CDATA[Transaction "start" started.]]></Details>
<Time><![CDATA[30-03-2022 - 15:23:59]]></Time>
<TimeTick>1648634039</TimeTick>
<NodeArgs eType="Transaction" icon="4" nRep="7" nType="Start Transaction" Source="Action1" SourceLine="0" >
<Disp><![CDATA[start]]></Disp>
</NodeArgs>
</Step>
<Step rID="T5">
<Obj plainTxt="False" ><![CDATA[SystemUtil]]></Obj>
<Details plainTxt="False" ><![CDATA[SystemUtil]]></Details>
<Time><![CDATA[30-03-2022 - 15:25:07]]></Time>
<TimeTick>1648634107</TimeTick>
<Step rID="T6">
<Obj plainTxt="False" ><![CDATA[Run "C:\Users\nikit\OneDrive\Desktop\Flight GUI.lnk",1]]></Obj>
<Details plainTxt="False" ><![CDATA[Run "C:\Users\nikit\OneDrive\Desktop\Flight GUI.lnk",1]]></Details>
<Time><![CDATA[30-03-2022 - 15:25:07]]></Time>
<TimeTick>1648634107</TimeTick>
<NodeArgs eType="Replay" icon="5" nRep="11" status="Passed" >
<Disp><![CDATA[Run "C:\Users\nikit\OneDrive\Desktop\Flight GUI.lnk",1]]></Disp>
</NodeArgs>
</Step>
<NodeArgs eType="Replay" icon="5" nRep="10" status="Passed" >
<Disp><![CDATA[SystemUtil]]></Disp>
</NodeArgs>
</Step>
<Step rID="T7">
<Obj plainTxt="False" ><![CDATA[HPE MyFlight Sample Applicatio]]></Obj>
<Details plainTxt="False" ><![CDATA[WpfWindow]]></Details>
<Time><![CDATA[30-03-2022 - 15:25:07]]></Time>
<TimeTick>1648634107</TimeTick>
<Step rID="T8">
<Obj plainTxt="False" ><![CDATA[agentName.Set]]></Obj>
<Details plainTxt="False" ><![CDATA["John"]]></Details>
<Time><![CDATA[30-03-2022 - 15:25:07]]></Time>
<TimeTick>1648634107</TimeTick>
<NodeArgs eType="Replay" icon="7" nRep="14" >
<Disp><![CDATA[agentName.Set]]></Disp>
</NodeArgs>
</Step>
<Step rID="T9">
<Obj plainTxt="False" ><![CDATA[password.Set]]></Obj>
<Details plainTxt="False" ><![CDATA["HP"]]></Details>
<Time><![CDATA[30-03-2022 - 15:25:08]]></Time>
<TimeTick>1648634108</TimeTick>
<NodeArgs eType="Replay" icon="7" nRep="16" >
<Disp><![CDATA[password.Set]]></Disp>
</NodeArgs>
</Step>
<Step rID="T10">
<Obj plainTxt="False" ><![CDATA[OK.Click]]></Obj>
<Details plainTxt="False" ><![CDATA[]]></Details>
<Time><![CDATA[30-03-2022 - 15:25:08]]></Time>
<TimeTick>1648634108</TimeTick>
<NodeArgs eType="Replay" icon="8" nRep="18" >
<Disp><![CDATA[OK.Click]]></Disp>
</NodeArgs>
</Step>
<Step rID="T11">
<Obj plainTxt="False" ><![CDATA[HPE MyFlight Sample Applicatio.Exist]]></Obj>
<Details plainTxt="False" ><![CDATA["Object exists"]]></Details>
<Time><![CDATA[30-03-2022 - 15:25:08]]></Time>
<TimeTick>1648634108</TimeTick>
<NodeArgs eType="Replay" icon="6" nRep="19" >
<Disp><![CDATA[HPE MyFlight Sample Applicatio.Exist]]></Disp>
</NodeArgs>
</Step>
<NodeArgs eType="Context" icon="6" nRep="13" >
<Disp><![CDATA[HPE MyFlight Sample Applicatio]]></Disp>
</NodeArgs>
</Step>
<Step rID="T12">
<Obj ><![CDATA[Login]]></Obj>
<Details ><![CDATA[Login Successful]]></Details>
<Time><![CDATA[30-03-2022 - 15:25:08]]></Time>
<TimeTick>1648634108</TimeTick>
<NodeArgs eType="User" icon="9" nRep="20" status="Passed" >
<Disp><![CDATA[Login]]></Disp>
</NodeArgs>
</Step>
<Step rID="T13">
<Obj plainTxt="False" ><![CDATA[HPE MyFlight Sample Applicatio]]></Obj>
<Details plainTxt="False" ><![CDATA[WpfWindow]]></Details>
<Time><![CDATA[30-03-2022 - 15:25:17]]></Time>
<TimeTick>1648634117</TimeTick>
<Step rID="T14">
<Obj plainTxt="False" ><![CDATA[WpfTabStrip.Select]]></Obj>
<Details plainTxt="False" ><![CDATA["SEARCH ORDER"]]></Details>
<Time><![CDATA[30-03-2022 - 15:25:17]]></Time>
<TimeTick>1648634117</TimeTick>
<NodeArgs eType="Replay" icon="10" nRep="23" >
<Disp><![CDATA[WpfTabStrip.Select]]></Disp>
</NodeArgs>
</Step>
<Step rID="T15">
<Obj plainTxt="False" ><![CDATA[byNumberRadio.Set]]></Obj>
<Details plainTxt="False" ><![CDATA[]]></Details>
<Time><![CDATA[30-03-2022 - 15:25:17]]></Time>
<TimeTick>1648634117</TimeTick>
<NodeArgs eType="Replay" icon="11" nRep="25" >
<Disp><![CDATA[byNumberRadio.Set]]></Disp>
</NodeArgs>
</Step>
<Step rID="T16">
<Obj plainTxt="False" ><![CDATA[byNumberWatermark.Set]]></Obj>
<Details plainTxt="False" ><![CDATA["4"]]></Details>
<Time><![CDATA[30-03-2022 - 15:25:18]]></Time>
<TimeTick>1648634118</TimeTick>
<NodeArgs eType="Replay" icon="7" nRep="27" >
<Disp><![CDATA[byNumberWatermark.Set]]></Disp>
</NodeArgs>
</Step>
<Step rID="T17">
<Obj plainTxt="False" ><![CDATA[SEARCH.Click]]></Obj>
<Details plainTxt="False" ><![CDATA[]]></Details>
<Time><![CDATA[30-03-2022 - 15:25:18]]></Time>
<TimeTick>1648634118</TimeTick>
<NodeArgs eType="Replay" icon="8" nRep="29" >
<Disp><![CDATA[SEARCH.Click]]></Disp>
</NodeArgs>
</Step>
<Step rID="T18">
<Obj plainTxt="False" ><![CDATA[NEW SEARCH.Click]]></Obj>
<Details plainTxt="False" ><![CDATA[]]></Details>
<Time><![CDATA[30-03-2022 - 15:25:18]]></Time>
<TimeTick>1648634118</TimeTick>
<NodeArgs eType="Replay" icon="8" nRep="31" >
<Disp><![CDATA[NEW SEARCH.Click]]></Disp>
</NodeArgs>
</Step>
<Step rID="T19">
<Obj plainTxt="False" ><![CDATA[WpfTabStrip.Select]]></Obj>
<Details plainTxt="False" ><![CDATA["SEARCH ORDER"]]></Details>
<Time><![CDATA[30-03-2022 - 15:25:21]]></Time>
<TimeTick>1648634121</TimeTick>
<NodeArgs eType="Replay" icon="10" nRep="33" >
<Disp><![CDATA[WpfTabStrip.Select]]></Disp>
</NodeArgs>
</Step>
<Step rID="T20">
<Obj plainTxt="False" ><![CDATA[byNumberRadio.Set]]></Obj>
<Details plainTxt="False" ><![CDATA[]]></Details>
<Time><![CDATA[30-03-2022 - 15:25:21]]></Time>
<TimeTick>1648634121</TimeTick>
<NodeArgs eType="Replay" icon="11" nRep="35" >
<Disp><![CDATA[byNumberRadio.Set]]></Disp>
</NodeArgs>
</Step>
<Step rID="T21">
<Obj plainTxt="False" ><![CDATA[byNumberWatermark.Set]]></Obj>
<Details plainTxt="False" ><![CDATA["7"]]></Details>
<Time><![CDATA[30-03-2022 - 15:25:22]]></Time>
<TimeTick>1648634122</TimeTick>
<NodeArgs eType="Replay" icon="7" nRep="37" >
<Disp><![CDATA[byNumberWatermark.Set]]></Disp>
</NodeArgs>
</Step>
<Step rID="T22">
<Obj plainTxt="False" ><![CDATA[SEARCH.Click]]></Obj>
<Details plainTxt="False" ><![CDATA[]]></Details>
<Time><![CDATA[30-03-2022 - 15:25:22]]></Time>
<TimeTick>1648634122</TimeTick>
<NodeArgs eType="Replay" icon="8" nRep="39" >
<Disp><![CDATA[SEARCH.Click]]></Disp>
</NodeArgs>
</Step>
<Step rID="T23">
<Obj plainTxt="False" ><![CDATA[NEW SEARCH.Click]]></Obj>
<Details plainTxt="False" ><![CDATA[]]></Details>
<Time><![CDATA[30-03-2022 - 15:25:22]]></Time>
<TimeTick>1648634122</TimeTick>
<NodeArgs eType="Replay" icon="8" nRep="41" >
<Disp><![CDATA[NEW SEARCH.Click]]></Disp>
</NodeArgs>
</Step>
<Step rID="T24">
<Obj plainTxt="False" ><![CDATA[WpfTabStrip.Select]]></Obj>
<Details plainTxt="False" ><![CDATA["SEARCH ORDER"]]></Details>
<Time><![CDATA[30-03-2022 - 15:25:25]]></Time>
<TimeTick>1648634125</TimeTick>
<NodeArgs eType="Replay" icon="10" nRep="43" >
<Disp><![CDATA[WpfTabStrip.Select]]></Disp>
</NodeArgs>
</Step>
<Step rID="T25">
<Obj plainTxt="False" ><![CDATA[byNumberRadio.Set]]></Obj>
<Details plainTxt="False" ><![CDATA[]]></Details>
<Time><![CDATA[30-03-2022 - 15:25:25]]></Time>
<TimeTick>1648634125</TimeTick>
<NodeArgs eType="Replay" icon="11" nRep="45" >
<Disp><![CDATA[byNumberRadio.Set]]></Disp>
</NodeArgs>
</Step>
<Step rID="T26">
<Obj plainTxt="False" ><![CDATA[byNumberWatermark.Set]]></Obj>
<Details plainTxt="False" ><![CDATA["3"]]></Details>
<Time><![CDATA[30-03-2022 - 15:25:25]]></Time>
<TimeTick>1648634125</TimeTick>
<NodeArgs eType="Replay" icon="7" nRep="47" >
<Disp><![CDATA[byNumberWatermark.Set]]></Disp>
</NodeArgs>
</Step>
<Step rID="T27">
<Obj plainTxt="False" ><![CDATA[SEARCH.Click]]></Obj>
<Details plainTxt="False" ><![CDATA[]]></Details>
<Time><![CDATA[30-03-2022 - 15:25:25]]></Time>
<TimeTick>1648634125</TimeTick>
<NodeArgs eType="Replay" icon="8" nRep="49" >
<Disp><![CDATA[SEARCH.Click]]></Disp>
</NodeArgs>
</Step>
<Step rID="T28">
<Obj plainTxt="False" ><![CDATA[NEW SEARCH.Click]]></Obj>
<Details plainTxt="False" ><![CDATA[]]></Details>
<Time><![CDATA[30-03-2022 - 15:25:26]]></Time>
<TimeTick>1648634126</TimeTick>
<NodeArgs eType="Replay" icon="8" nRep="51" >
<Disp><![CDATA[NEW SEARCH.Click]]></Disp>
</NodeArgs>
</Step>
<Step rID="T29">
<Obj plainTxt="False" ><![CDATA[WpfTabStrip.Select]]></Obj>
<Details plainTxt="False" ><![CDATA["SEARCH ORDER"]]></Details>
<Time><![CDATA[30-03-2022 - 15:25:29]]></Time>
<TimeTick>1648634129</TimeTick>
<NodeArgs eType="Replay" icon="10" nRep="53" >
<Disp><![CDATA[WpfTabStrip.Select]]></Disp>
</NodeArgs>
</Step>
<Step rID="T30">
<Obj plainTxt="False" ><![CDATA[byNumberRadio.Set]]></Obj>
<Details plainTxt="False" ><![CDATA[]]></Details>
<Time><![CDATA[30-03-2022 - 15:25:29]]></Time>
<TimeTick>1648634129</TimeTick>
<NodeArgs eType="Replay" icon="11" nRep="55" >
<Disp><![CDATA[byNumberRadio.Set]]></Disp>
</NodeArgs>
</Step>
<Step rID="T31">
<Obj plainTxt="False" ><![CDATA[byNumberWatermark.Set]]></Obj>
<Details plainTxt="False" ><![CDATA["6"]]></Details>
<Time><![CDATA[30-03-2022 - 15:25:29]]></Time>
<TimeTick>1648634129</TimeTick>
<NodeArgs eType="Replay" icon="7" nRep="57" >
<Disp><![CDATA[byNumberWatermark.Set]]></Disp>
</NodeArgs>
</Step>
<Step rID="T32">
<Obj plainTxt="False" ><![CDATA[SEARCH.Click]]></Obj>
<Details plainTxt="False" ><![CDATA[]]></Details>
<Time><![CDATA[30-03-2022 - 15:25:29]]></Time>
<TimeTick>1648634129</TimeTick>
<NodeArgs eType="Replay" icon="8" nRep="59" >
<Disp><![CDATA[SEARCH.Click]]></Disp>
</NodeArgs>
</Step>
<Step rID="T33">
<Obj plainTxt="False" ><![CDATA[NEW SEARCH.Click]]></Obj>
<Details plainTxt="False" ><![CDATA[]]></Details>
<Time><![CDATA[30-03-2022 - 15:25:29]]></Time>
<TimeTick>1648634129</TimeTick>
<NodeArgs eType="Replay" icon="8" nRep="61" >
<Disp><![CDATA[NEW SEARCH.Click]]></Disp>
</NodeArgs>
</Step>
<Step rID="T34">
<Obj plainTxt="False" ><![CDATA[WpfTabStrip.Select]]></Obj>
<Details plainTxt="False" ><![CDATA["SEARCH ORDER"]]></Details>
<Time><![CDATA[30-03-2022 - 15:25:32]]></Time>
<TimeTick>1648634132</TimeTick>
<NodeArgs eType="Replay" icon="10" nRep="63" >
<Disp><![CDATA[WpfTabStrip.Select]]></Disp>
</NodeArgs>
</Step>
<Step rID="T35">
<Obj plainTxt="False" ><![CDATA[byNumberRadio.Set]]></Obj>
<Details plainTxt="False" ><![CDATA[]]></Details>
<Time><![CDATA[30-03-2022 - 15:25:32]]></Time>
<TimeTick>1648634132</TimeTick>
<NodeArgs eType="Replay" icon="11" nRep="65" >
<Disp><![CDATA[byNumberRadio.Set]]></Disp>
</NodeArgs>
</Step>
<Step rID="T36">
<Obj plainTxt="False" ><![CDATA[byNumberWatermark.Set]]></Obj>
<Details plainTxt="False" ><![CDATA["4"]]></Details>
<Time><![CDATA[30-03-2022 - 15:25:33]]></Time>
<TimeTick>1648634133</TimeTick>
<NodeArgs eType="Replay" icon="7" nRep="67" >
<Disp><![CDATA[byNumberWatermark.Set]]></Disp>
</NodeArgs>
</Step>
<Step rID="T37">
<Obj plainTxt="False" ><![CDATA[SEARCH.Click]]></Obj>
<Details plainTxt="False" ><![CDATA[]]></Details>
<Time><![CDATA[30-03-2022 - 15:25:33]]></Time>
<TimeTick>1648634133</TimeTick>
<NodeArgs eType="Replay" icon="8" nRep="69" >
<Disp><![CDATA[SEARCH.Click]]></Disp>
</NodeArgs>
</Step>
<Step rID="T38">
<Obj plainTxt="False" ><![CDATA[NEW SEARCH.Click]]></Obj>
<Details plainTxt="False" ><![CDATA[]]></Details>
<Time><![CDATA[30-03-2022 - 15:25:33]]></Time>
<TimeTick>1648634133</TimeTick>
<NodeArgs eType="Replay" icon="8" nRep="71" >
<Disp><![CDATA[NEW SEARCH.Click]]></Disp>
</NodeArgs>
</Step>
<Step rID="T39">
<Obj plainTxt="False" ><![CDATA[WpfTabStrip.Select]]></Obj>
<Details plainTxt="False" ><![CDATA["SEARCH ORDER"]]></Details>
<Time><![CDATA[30-03-2022 - 15:25:36]]></Time>
<TimeTick>1648634136</TimeTick>
<NodeArgs eType="Replay" icon="10" nRep="73" >
<Disp><![CDATA[WpfTabStrip.Select]]></Disp>
</NodeArgs>
</Step>
<Step rID="T40">
<Obj plainTxt="False" ><![CDATA[byNumberRadio.Set]]></Obj>
<Details plainTxt="False" ><![CDATA[]]></Details>
<Time><![CDATA[30-03-2022 - 15:25:36]]></Time>
<TimeTick>1648634136</TimeTick>
<NodeArgs eType="Replay" icon="11" nRep="75" >
<Disp><![CDATA[byNumberRadio.Set]]></Disp>
</NodeArgs>
</Step>
<Step rID="T41">
<Obj plainTxt="False" ><![CDATA[byNumberWatermark.Set]]></Obj>
<Details plainTxt="False" ><![CDATA["2"]]></Details>
<Time><![CDATA[30-03-2022 - 15:25:36]]></Time>
<TimeTick>1648634136</TimeTick>
<NodeArgs eType="Replay" icon="7" nRep="77" >
<Disp><![CDATA[byNumberWatermark.Set]]></Disp>
</NodeArgs>
</Step>
<Step rID="T42">
<Obj plainTxt="False" ><![CDATA[SEARCH.Click]]></Obj>
<Details plainTxt="False" ><![CDATA[]]></Details>
<Time><![CDATA[30-03-2022 - 15:25:36]]></Time>
<TimeTick>1648634136</TimeTick>
<NodeArgs eType="Replay" icon="8" nRep="79" >
<Disp><![CDATA[SEARCH.Click]]></Disp>
</NodeArgs>
</Step>
<Step rID="T43">
<Obj plainTxt="False" ><![CDATA[NEW SEARCH.Click]]></Obj>
<Details plainTxt="False" ><![CDATA[]]></Details>
<Time><![CDATA[30-03-2022 - 15:25:36]]></Time>
<TimeTick>1648634136</TimeTick>
<NodeArgs eType="Replay" icon="8" nRep="81" >
<Disp><![CDATA[NEW SEARCH.Click]]></Disp>
</NodeArgs>
</Step>
<Step rID="T44">
<Obj plainTxt="False" ><![CDATA[HPE MyFlight Sample Applicatio.Close]]></Obj>
<Details plainTxt="False" ><![CDATA[]]></Details>
<Time><![CDATA[30-03-2022 - 15:25:44]]></Time>
<TimeTick>1648634144</TimeTick>
<NodeArgs eType="Replay" icon="6" nRep="83" >
<Disp><![CDATA[HPE MyFlight Sample Applicatio.Close]]></Disp>
</NodeArgs>
</Step>
<Step rID="T45">
<Obj plainTxt="False" ><![CDATA[HPE MyFlight Sample Applicatio.Exist]]></Obj>
<Details plainTxt="False" ><![CDATA["Object does not exist"]]></Details>
<Time><![CDATA[30-03-2022 - 15:25:54]]></Time>
<TimeTick>1648634154</TimeTick>
<NodeArgs eType="Replay" icon="6" nRep="85" >
<Disp><![CDATA[HPE MyFlight Sample Applicatio.Exist]]></Disp>
</NodeArgs>
</Step>
<NodeArgs eType="Context" icon="6" nRep="22" >
<Disp><![CDATA[HPE MyFlight Sample Applicatio]]></Disp>
</NodeArgs>
</Step>
<Step rID="T46">
<Obj ><![CDATA[Closeapp]]></Obj>
<Details ><![CDATA[Closeapp unSuccessful]]></Details>
<Time><![CDATA[30-03-2022 - 15:25:54]]></Time>
<TimeTick>1648634154</TimeTick>
<NodeArgs eType="User" icon="9" nRep="86" status="Passed" >
<Disp><![CDATA[Closeapp]]></Disp>
</NodeArgs>
</Step>
<Step rID="T47">
<Obj plainTxt="False" ><![CDATA[start]]></Obj>
<Details plainTxt="False" ><![CDATA[Transaction "start" ended with "Pass" status (Total Duration: 141.8742 sec).]]></Details>
<Time><![CDATA[30-03-2022 - 15:26:21]]></Time>
<TimeTick>1648634181</TimeTick>
<NodeArgs eType="Transaction" icon="12" nRep="87" nType="End Transaction" Source="Action1" SourceLine="89" >
<Disp><![CDATA[start]]></Disp>
</NodeArgs>
</Step>
<Summary sTime="30-03-2022 - 15:23:58" eTime="30-03-2022 - 15:26:21" passed="3" failed="0" warnings="0" ></Summary>
<NodeArgs eType="StartAction" icon="3" nRep="6" status="Passed" >
<Disp><![CDATA[Action1 Summary]]></Disp>
</NodeArgs>
</Action>
<Action rID="T48">
<AName><![CDATA[Action2]]></AName>
<Summary sTime="30-03-2022 - 15:26:21" eTime="30-03-2022 - 15:26:22" passed="0" failed="0" warnings="0" ></Summary>
<NodeArgs eType="StartAction" icon="3" nRep="89" >
<Disp><![CDATA[Action2 Summary]]></Disp>
</NodeArgs>
</Action>
<Action rID="T49">
<AName><![CDATA[Action3]]></AName>
<Summary sTime="30-03-2022 - 15:26:22" eTime="30-03-2022 - 15:26:22" passed="0" failed="0" warnings="0" ></Summary>
<NodeArgs eType="StartAction" icon="3" nRep="91" >
<Disp><![CDATA[Action3 Summary]]></Disp>
</NodeArgs>
</Action>
<Action rID="T50">
<AName><![CDATA[Action4]]></AName>
<Summary sTime="30-03-2022 - 15:26:22" eTime="30-03-2022 - 15:26:22" passed="0" failed="0" warnings="0" ></Summary>
<NodeArgs eType="StartAction" icon="3" nRep="93" >
<Disp><![CDATA[Action4 Summary]]></Disp>
</NodeArgs>
</Action>
<Summary sTime="30-03-2022 - 15:23:58" eTime="30-03-2022 - 15:26:22" passed="3" failed="0" warnings="0" ></Summary>
<NodeArgs eType="StartTest" icon="1" nRep="3" status="Passed" >
<Disp><![CDATA[Test Driver Summary]]></Disp>
</NodeArgs>
</Doc>
</Report>